cell_id,cell-type,cell disease state,tissue,tissue disease state,source,st technology,caption
aaohmmlp-1,cardiac muscle myoblast.,nondisease,Femur,nondisease,Mouse,Xenium,"[Image Pair 1]: This single cell is a non-cancerous cardiac muscle myoblast from a mouse femur, imaged with Xenium spatial transcriptomics. It displays an oval, centrally located nucleus and moderate cell size, with scant cytoplasm. In the tissue section, myoblasts are identifiable within muscle bundles, serving as progenitor cells critical for muscle repair and regeneration, but not typically present in high abundance in femoral bone."
admgooik-1,macrophage.,nondisease,Femur,nondisease,Mouse,Xenium,"[Image Pair 2]: This single cell is a non-cancerous macrophage from the mouse femur, visualized with Xenium spatial transcriptomics. Macrophages are round to oval with abundant, lightly stained cytoplasm and an eccentric nucleus. In the patch, these cells are dispersed among dense hematopoietic cells, where they function in phagocytosis, debris clearance, and immune surveillance within the bone marrow."
adnhlehj-1,macrophage.,nondisease,Femur,nondisease,Mouse,Xenium,"[Image Pair 3]: This single cell is a non-cancerous macrophage from mouse femur, obtained via Xenium spatial transcriptomics. Macrophages are moderate-to-large, round cells with pale, granular cytoplasm and a single kidney-shaped or eccentric nucleus. In the tissue, they reside among marrow cells, providing essential functions in innate immunity and tissue remodeling."
afemibeb-1,cardiac muscle myoblast.,nondisease,Femur,nondisease,Mouse,Xenium,"[Image Pair 4]: This single cell is a non-cancerous cardiac muscle myoblast from mouse femur, imaged via Xenium spatial transcriptomics technology. The cell has an oval nucleus and limited cytoplasm, reflecting an undifferentiated, progenitor phenotype. In the tissue section, such myoblasts appear dispersed along muscle fibers, contributing to regeneration and myogenic differentiation when activated."
afemiklm-1,endothelial cell.,nondisease,Femur,nondisease,Mouse,Xenium,"[Image Pair 5]: This single cell is a non-cancerous endothelial cell from mouse femur, captured with Xenium spatial transcriptomics. Endothelial cells are small, elongated, and flattened, with a central nucleus and scant cytoplasm. In bone marrow tissue, they line the blood vessels, playing a vital role in forming a selective barrier for blood-tissue exchange and maintaining marrow vascular integrity."
afgcdggl-1,erythrocyte.,nondisease,Femur,nondisease,Mouse,Xenium,"[Image Pair 6]: This single cell is a non-cancerous erythrocyte from mouse femur, imaged with Xenium spatial transcriptomics. Erythrocytes are small, round, and biconcave, lacking nuclei and organelles. In the marrow, they appear as densely packed, pale red cells, essential for oxygen transport throughout the body."
afgeanpf-1,neutrophil.,nondisease,Femur,nondisease,Mouse,Xenium,"[Image Pair 7]: This single cell is a non-cancerous neutrophil from the mouse femur, visualized with Xenium spatial transcriptomics. Neutrophils are moderately sized, with a characteristic multi-lobed nucleus and pale cytoplasm. In the tissue, they appear in clusters, functioning as primary responders in innate immunity and phagocytosis."
afgjljpl-1,neutrophil.,nondisease,Femur,nondisease,Mouse,Xenium,"[Image Pair 8]: This single cell is a non-cancerous neutrophil from the mouse femur, captured via Xenium spatial transcriptomics. Neutrophils are small-to-medium cells with multilobed nuclei and faintly granular cytoplasm. Within the tissue, they are abundant within the marrow matrix, crucial for rapid response to infection and microbial clearance."
afgkaekb-1,megakaryocyte.,nondisease,Femur,nondisease,Mouse,Xenium,"[Image Pair 9]: This single cell is a non-cancerous megakaryocyte from the mouse femur, imaged using Xenium spatial transcriptomics. Megakaryocytes are very large, polygonal cells with an enormous, lobulated nucleus and abundant cytoplasm. In the marrow tissue, they are rare but easily recognizable, responsible for the production of platelets essential for hemostasis."
afhenhbi-1,endothelial cell.,nondisease,Femur,nondisease,Mouse,Xenium,"[Image Pair 10]: This single cell is a non-cancerous endothelial cell from mouse femur, imaged via Xenium spatial transcriptomics technology. Endothelial cells are flattened and elongated with an oval nucleus and minimal cytoplasm. In the histological patch, they delineate vascular walls, facilitating selective transport and maintaining marrow blood vessel integrity."
afialogb-1,neutrophil.,nondisease,Femur,nondisease,Mouse,Xenium,"[Image Pair 1]: This neutrophil from the mouse femur displays a multilobed nucleus and granular cytoplasm. Neutrophils are small, round cells, typically 10–12 µm in diameter, with segmented nuclei that facilitate rapid migration through tissues. Their granular cytoplasm contains enzymes crucial for the destruction of pathogens, making them the first line of defense in acute inflammation."
afigbmoj-1,endothelial cell.,nondisease,Femur,nondisease,Mouse,Xenium,"[Image Pair 2]: This endothelial cell, observed in the mouse femur, exhibits an elongated, flattened morphology typical of cells that line blood vessels. These cells are thin and form continuous linings, facilitating the selective exchange of nutrients, gases, and waste between blood and surrounding tissues while maintaining vessel integrity."
afjleole-1,megakaryocyte.,nondisease,Femur,nondisease,Mouse,Xenium,"[Image Pair 3]: This megakaryocyte from the mouse femur is a very large, oval cell with a multilobulated, polyploid nucleus and abundant, lightly stained cytoplasm. Megakaryocytes are the largest cells in the bone marrow and function as platelet precursors, with cytoplasmic extensions that fragment to release platelets into the bloodstream."
afmebopf-1,macrophage.,nondisease,Femur,nondisease,Mouse,Xenium,"[Image Pair 4]: This macrophage displays an irregular shape with abundant cytoplasm and a round to oval nucleus. Macrophages are larger than most marrow cells and play a role in phagocytosis, engulfing debris and pathogens, and orchestrating inflammatory and immune responses within the femur's marrow microenvironment."
afpcfkff-1,endothelial cell.,nondisease,Femur,nondisease,Mouse,Xenium,"[Image Pair 5]: This endothelial cell, identifiable by its flattened and elongated shape, is found lining blood vessels in the mouse femur. These cells are essential for creating a selective barrier, permitting controlled passage of substances between the bloodstream and bone marrow while supporting vascular homeostasis."
agjmahkl-1,monocyte.,nondisease,Femur,nondisease,Mouse,Xenium,"[Image Pair 6]: This monocyte, found in the mouse femur, is a large, round cell with abundant pale cytoplasm and a characteristic bean-shaped or indented nucleus. Monocytes circulate in blood and migrate into tissues, where they differentiate into macrophages or dendritic cells to support immune defense and tissue repair."
agkknkab-1,macrophage.,nondisease,Femur,nondisease,Mouse,Xenium,"[Image Pair 7]: This macrophage, seen in the mouse femur, has a relatively large, amorphous shape and a round eccentric nucleus. The abundant cytoplasm often contains phagocytosed material, highlighting the cell’s key role in clearing debris, pathogens, and orchestrating immune responses within the marrow environment."
agliofpc-1,erythrocyte.,nondisease,Femur,nondisease,Mouse,Xenium,"[Image Pair 8]: This erythrocyte from the mouse femur exhibits a small, biconcave shape without a nucleus, optimizing its surface area for gas exchange. Erythrocytes are densely packed and stain pink, reflecting high hemoglobin content, and their primary function is to deliver oxygen throughout the tissues."
agpnkikc-1,endothelial cell.,nondisease,Femur,nondisease,Mouse,Xenium,"[Image Pair 9]: This endothelial cell in the mouse femur appears as a thin, elongated cell tightly associated with blood vessel walls. Its flattened morphology allows selective exchange of molecules between the blood and the marrow, playing a crucial role in maintaining vascular barrier function and local homeostasis."
ahaknhkb-1,macrophage.,nondisease,Femur,nondisease,Mouse,Xenium,"[Image Pair 10]: This macrophage in the mouse femur shows an irregular outline and ample cytoplasm, often with visible ingested material. Macrophages are vital for phagocytosis of cellular debris and pathogens and serve as key regulators of inflammation and tissue remodeling within the bone marrow."
ahbkpfmm-1,megakaryocyte.,nondisease,Femur,nondisease,Mouse,Xenium,"[Image 1]: This non-cancerous megakaryocyte, located in mouse femur bone marrow and visualized using Xenium spatial transcriptomics, exhibits a very large size, irregular lobulated nucleus, and abundant granular cytoplasm. Megakaryocytes are responsible for platelet production and distinguished by their massive, polyploid nuclei and expansive cell bodies compared to surrounding hematopoietic cells."
aicljgkd-1,monocyte.,nondisease,Femur,nondisease,Mouse,Xenium,"[Image 2]: This non-cancerous monocyte, derived from mouse femur and visualized with Xenium spatial transcriptomics, shows a relatively large, oval cell morphology with abundant pale cytoplasm and a single, kidney-shaped or indented nucleus, reflecting its function as a precursor to macrophages and dendritic cells in the mononuclear phagocyte system."
aiffjifj-1,neutrophil.,nondisease,Femur,nondisease,Mouse,Xenium,"[Image 3]: This non-cancerous neutrophil from the mouse femur, imaged via Xenium spatial transcriptomics, is a small to medium-sized cell with a multilobed nucleus and granular, pale cytoplasm, designed for rapid migration and phagocytosis of pathogens as a key effector of acute inflammation."
aiffljdj-1,neutrophil.,nondisease,Femur,nondisease,Mouse,Xenium,"[Image 4]: This non-cancerous neutrophil from mouse femur, obtained by Xenium spatial transcriptomics, displays a characteristic multi-lobed nucleus and faintly granular cytoplasm, optimized for mobility and antimicrobial activity as part of the innate immune response."
aigpefbn-1,erythroblast.,nondisease,Femur,nondisease,Mouse,Xenium,"[Image 5]: This non-cancerous erythroblast from mouse femur, analyzed by Xenium spatial transcriptomics, features a round, basophilic nucleus with a moderate amount of blue-staining cytoplasm, signifying its developmental role in erythropoiesis as it matures into an anucleate erythrocyte."
aihehlcp-1,megakaryocyte.,nondisease,Femur,nondisease,Mouse,Xenium,"[Image 6]: This non-cancerous megakaryocyte from the mouse femur, visualized with Xenium spatial transcriptomics, is markedly large with a multilobed, polyploid nucleus and dense cytoplasm, serving as the progenitor for platelet formation within the bone marrow."
aiiidgbb-1,neutrophil.,nondisease,Femur,nondisease,Mouse,Xenium,"[Image 7]: This non-cancerous neutrophil in mouse femur, imaged by Xenium spatial transcriptomics, has a segmented nucleus and fine granular cytoplasm, traits that support its function as a first responder to infection or tissue injury."
aiijcdhk-1,neutrophil.,nondisease,Femur,nondisease,Mouse,Xenium,"[Image 8]: This non-cancerous neutrophil from mouse femur, imaged with Xenium spatial transcriptomics, presents a multi-lobed nucleus and lightly granular cytoplasm, reflecting its role in phagocytosis and rapid immune defense against infection."
aikedjkc-1,erythrocyte.,nondisease,Femur,nondisease,Mouse,Xenium,"[Image 9]: This non-cancerous erythrocyte from mouse femur, assessed with Xenium spatial transcriptomics, is round, small, and lacks a nucleus, with a homogenous pink cytoplasm due to hemoglobin, specialized for oxygen and carbon dioxide transport in blood circulation."
ainiogda-1,megakaryocyte.,nondisease,Femur,nondisease,Mouse,Xenium,"[Image 10]: This non-cancerous megakaryocyte from mouse femur, imaged with Xenium spatial transcriptomics, is notably large and contains a lobulated, polyploid nucleus and extensive cytoplasm, central to platelet production and hematopoietic homeostasis in the bone marrow."
aleofjhh-1,macrophage.,nondisease,Femur,nondisease,Mouse,Xenium,"[Image Pair 1]: This single cell is a non-cancerous macrophage from mouse femur, displaying a large, irregularly shaped cell body with abundant pale cytoplasm and an eccentric nucleus. Macrophages function as professional phagocytes, clearing debris and pathogens within the bone marrow environment, and aiding in tissue homeostasis."
alfeggam-1,neutrophil.,nondisease,Femur,nondisease,Mouse,Xenium,"[Image Pair 2]: This single cell is a non-cancerous neutrophil from mouse femur, characterized by a small, round cell body and a segmented, multi-lobed nucleus. Neutrophils are the first responders in innate immune defense, quickly migrating to sites of infection to engulf and destroy pathogens."
algmbeih-1,erythroblast.,nondisease,Femur,nondisease,Mouse,Xenium,"[Image Pair 3]: This single cell is a non-cancerous erythroblast from the mouse femur, presenting a round shape with a relatively large, darkly stained nucleus and scant cytoplasm. Erythroblasts are immature red blood cell precursors responsible for synthesizing hemoglobin prior to enucleation during erythropoiesis."
aliglkpe-1,neutrophil.,nondisease,Femur,nondisease,Mouse,Xenium,"[Image Pair 4]: This single cell is a non-cancerous neutrophil from mouse femur, displaying a distinctive multi-lobed nucleus and granular cytoplasm. Neutrophils are essential for acute immune responses, utilizing chemotaxis and phagocytosis to eliminate invading microbes in the bone marrow and peripheral blood."
aljhpejk-1,megakaryocyte.,nondisease,Femur,nondisease,Mouse,Xenium,"[Image Pair 5]: This single cell is a non-cancerous megakaryocyte from mouse femur, notable for its very large size, lobulated nucleus, and abundant cytoplasm. Megakaryocytes are responsible for producing platelets through cytoplasmic fragmentation, a critical process for blood clotting."
aljmijji-1,endothelial cell.,nondisease,Femur,nondisease,Mouse,Xenium,"[Image Pair 6]: This single cell is a non-cancerous endothelial cell from the mouse femur, exhibiting an elongated, spindle-like morphology with a flattened nucleus. Endothelial cells line the marrow blood vessels, regulating vascular permeability, hematopoietic cell trafficking, and maintaining tissue-blood barrier integrity."
alkbmcoh-1,megakaryocyte.,nondisease,Femur,nondisease,Mouse,Xenium,"[Image Pair 7]: This single cell is a non-cancerous megakaryocyte from the mouse femur, featuring a massive, irregularly shaped cell with multilobed nucleus and voluminous cytoplasm. Megakaryocytes generate platelets vital for hemostasis by releasing cytoplasmic fragments into the bloodstream."
amoaodle-1,erythrocyte.,nondisease,Femur,nondisease,Mouse,Xenium,"[Image Pair 8]: This single cell is a non-cancerous erythrocyte from mouse femur, identifiable by its small, round, anucleate, and biconcave disc-shaped structure. Erythrocytes are specialized for oxygen transport, utilizing hemoglobin to efficiently carry oxygen throughout the body."
ampnmfbi-1,macrophage.,nondisease,Femur,nondisease,Mouse,Xenium,"[Image Pair 9]: This single cell is a non-cancerous macrophage from mouse femur, with an irregular outline, prominent cytoplasm, and centrally located nucleus. Macrophages play a pivotal role in clearing apoptotic cells and supporting hematopoiesis within the bone marrow."
anadnbci-1,megakaryocyte.,nondisease,Femur,nondisease,Mouse,Xenium,"[Image Pair 10]: This single cell is a non-cancerous megakaryocyte from the mouse femur, shown as a very large cell containing a multilobed, polyploid nucleus and extensive granular cytoplasm. Megakaryocytes are responsible for thrombopoiesis—producing platelets required for normal blood clotting."
anbcjaaa-1,megakaryocyte.,nondisease,Femur,nondisease,Mouse,Xenium,"[Image Pair 1]: This non-cancerous megakaryocyte, found in the mouse femur and imaged by Xenium spatial transcriptomics, displays a large, irregularly shaped morphology with abundant cytoplasm and a multilobed nucleus. Megakaryocytes are the largest hematopoietic cells in bone marrow, responsible for platelet production through cytoplasmic fragmentation."
anccbdop-1,macrophage.,nondisease,Femur,nondisease,Mouse,Xenium,"[Image Pair 2]: This non-cancerous macrophage from mouse femur tissue, visualized using Xenium spatial transcriptomics, is medium to large in size with an irregular or oval shape and often exhibits a slightly foamy cytoplasm. Macrophages function as phagocytic cells, clearing cellular debris and pathogens from the bone marrow microenvironment."
anjhcial-1,neutrophil.,nondisease,Femur,nondisease,Mouse,Xenium,"[Image Pair 3]: This non-cancerous neutrophil from mouse femur, captured via Xenium spatial transcriptomics, is a small to medium-sized cell with a multilobed nucleus and scant, pale cytoplasm. Neutrophils are key innate immune cells, rapidly responding to infections by engulfing and destroying microbes."
ankhmane-1,endothelial cell.,nondisease,Femur,nondisease,Mouse,Xenium,"[Image Pair 4]: This non-cancerous endothelial cell, visualized in mouse femur using Xenium spatial transcriptomics, exhibits an elongated, flattened morphology forming a thin monolayer lining the blood vessels. Endothelial cells play a critical role in maintaining vascular integrity, regulating blood flow, and mediating nutrient exchange."
anklenlp-1,macrophage.,nondisease,Femur,nondisease,Mouse,Xenium,"[Image Pair 5]: This non-cancerous macrophage, imaged from mouse femur with Xenium spatial transcriptomics, features an irregular, oval to round shape with a distinctive pale, granular cytoplasm. Macrophages are professional phagocytes, clearing dead cells and pathogens and orchestrating immune responses within the bone marrow."
anloakbe-1,megakaryocyte.,nondisease,Femur,nondisease,Mouse,Xenium,"[Image Pair 6]: This non-cancerous megakaryocyte in mouse femur, captured using Xenium spatial transcriptomics, is notably large with irregular, lobulated nuclei and abundant cytoplasm. Megakaryocytes are specialized for producing platelets, which are critical for blood clotting and maintaining hemostasis."
anmgnjba-1,endothelial cell.,nondisease,Femur,nondisease,Mouse,Xenium,"[Image Pair 7]: This non-cancerous endothelial cell from mouse femur displays an elongated and spindle-shaped morphology, forming a thin lining along vascular channels as seen with Xenium spatial transcriptomics. Endothelial cells regulate vascular permeability, blood flow, and homeostasis within the bone marrow."
anmihopi-1,megakaryocyte.,nondisease,Femur,nondisease,Mouse,Xenium,"[Image Pair 8]: This non-cancerous megakaryocyte in the mouse femur, visualized by Xenium spatial transcriptomics, is a large polyploid cell with a lobulated nucleus and extensive cytoplasm. Its principal function is to generate blood platelets essential for hemostasis and wound repair."
anpeokcc-1,neutrophil.,nondisease,Femur,nondisease,Mouse,Xenium,"[Image Pair 9]: This non-cancerous neutrophil in mouse femur, visualized using Xenium spatial transcriptomics, is a small, round cell with a segmented nucleus and sparse cytoplasm. Neutrophils are crucial for early immune defense, rapidly responding to infection sites and executing phagocytosis."
aoaggmcf-1,monocyte.,nondisease,Femur,nondisease,Mouse,Xenium,"[Image Pair 10]: This non-cancerous monocyte from mouse femur, imaged with Xenium spatial transcriptomics, is a large, round-to-oval cell with abundant cytoplasm and a kidney-shaped nucleus. Monocytes circulate in blood and migrate into tissues, differentiating into macrophages or dendritic cells to mediate innate immunity."
aoappnhf-1,monocyte.,nondisease,Femur,nondisease,Mouse,Xenium,"[Image Pair 1]: The single cell is a non-cancerous monocyte from mouse femur, displaying a large, oval to kidney-shaped nucleus and moderate cytoplasm. Monocytes are medium to large cells with a pale-staining, often indented nucleus, functioning in phagocytosis and immune surveillance within the bone marrow microenvironment."
aobageop-1,endothelial cell.,nondisease,Femur,nondisease,Mouse,Xenium,"[Image Pair 2]: The single cell is a non-cancerous endothelial cell from mouse femur, showing an elongated, thin morphology with a flattened nucleus and scant cytoplasm. Endothelial cells line blood vessels, forming a barrier for selective permeability and facilitating nutrient and gas exchange in the marrow."
aoodphnm-1,neutrophil.,nondisease,Femur,nondisease,Mouse,Xenium,"[Image Pair 3]: The single cell is a non-cancerous neutrophil from mouse femur, characterized by a segmented, multi-lobed nucleus and granular cytoplasm. Neutrophils are medium-sized, round cells specialized in rapid response phagocytosis and defense against bacterial infections within bone marrow."
aopghppd-1,monocyte.,nondisease,Femur,nondisease,Mouse,Xenium,"[Image Pair 4]: The single cell is a non-cancerous monocyte from mouse femur, featuring an irregularly shaped, indented nucleus with abundant blue-gray cytoplasm. These cells serve as phagocytes and precursors for macrophages and dendritic cells, critical for innate immune defense in bone marrow."
apaalmmf-1,macrophage.,nondisease,Femur,nondisease,Mouse,Xenium,"[Image Pair 5]: The single cell is a non-cancerous macrophage from mouse femur, exhibiting a large, irregular shape with abundant cytoplasm and an eccentric oval nucleus. Macrophages are specialized for engulfing debris and pathogens, supporting tissue homeostasis and immune response in the marrow."
apaeomio-1,endothelial cell.,nondisease,Femur,nondisease,Mouse,Xenium,"[Image Pair 6]: The single cell is a non-cancerous endothelial cell from mouse femur, long and spindle-shaped with a flattened nucleus and minimal cytoplasm. These cells line marrow vasculature, controlling molecular trafficking and maintaining hematopoietic niche integrity."
apbmcpno-1,erythroid lineage cell.,nondisease,Femur,nondisease,Mouse,Xenium,"[Image Pair 7]: The single cell is a non-cancerous erythroid lineage cell from mouse femur, round and small with a dense, round nucleus occupying most of the cell. Erythroid lineage cells give rise to red blood cells and are essential for oxygen transport after maturation."
apdcppik-1,erythroblast.,nondisease,Femur,nondisease,Mouse,Xenium,"[Image Pair 8]: The single cell is a non-cancerous erythroblast from mouse femur, small and round with a deeply basophilic, condensed nucleus and scant cytoplasm. Erythroblasts are developing red blood cells, actively synthesizing hemoglobin during erythropoiesis."
apfllcjb-1,monocyte.,nondisease,Femur,nondisease,Mouse,Xenium,"[Image Pair 9]: The single cell is a non-cancerous monocyte from mouse femur, with a moderate size, irregular/kidney-shaped nucleus, and light cytoplasm. Monocytes circulate as immune precursors, differentiating into macrophages or dendritic cells in tissues."
aphpjeae-1,capillary endothelial cell.,nondisease,Femur,nondisease,Mouse,Xenium,"[Image Pair 10]: The single cell is a non-cancerous capillary endothelial cell from mouse femur, exhibiting a thin, elongated morphology with flattened nucleus. Capillary endothelial cells construct the vascular lumen, facilitating nutrient delivery and waste removal in the bone marrow."
blhplllb-1,cardiac muscle myoblast.,nondisease,Femur,nondisease,Mouse,Xenium,"[Image Pair 1]: This cardiac muscle myoblast exhibits an elongated, spindle-shaped morphology with prominent, centrally located nuclei. The cell is moderately sized, with striated cytoplasm indicative of its contractile function. Located within the mouse femur, this non-cancerous myoblast supports muscle repair and regeneration by differentiating into mature cardiac muscle fibers."
chcbnkdm-1,endothelial cell.,nondisease,Femur,nondisease,Mouse,Xenium,"[Image Pair 2]: The endothelial cell displays a flattened, polygonal shape with a thin, elongated nucleus, characteristic of cells lining blood vessels. Its small size and delicate structure facilitate selective barrier function and vascular homeostasis within the non-cancerous mouse femur tissue."
chdbngdf-1,endothelial cell.,nondisease,Femur,nondisease,Mouse,Xenium,"[Image Pair 3]: The endothelial cell exhibits an elongated, spindle-shaped profile with compressed cytoplasm and a prominent oval nucleus, typical for vascular lining cells. These cells form the inner lining of blood vessels, maintaining vascular permeability and regulating exchange of molecules in the mouse femur."
chdhjeme-1,endothelial cell.,nondisease,Femur,nondisease,Mouse,Xenium,"[Image Pair 4]: This endothelial cell is small, rounded to oval, with a dense, dark-stained nucleus and minimal cytoplasm. Positioned within the femoral vasculature, it contributes to vessel integrity and regulates blood-tissue interactions in non-cancerous mouse bone."
chfpalka-1,endothelial cell.,nondisease,Femur,nondisease,Mouse,Xenium,"[Image Pair 5]: The endothelial cell appears round to oval with a compact, dark-staining nucleus, and scant bordering cytoplasm. These cells form a smooth monolayer on the vessel wall, enabling efficient blood flow and barrier function within the mouse femur."
chmgkhom-1,endothelial cell.,nondisease,Femur,nondisease,Mouse,Xenium,"[Image Pair 6]: The image reveals an endothelial cell with an inconspicuous, flattened morphology and a faintly stained nucleus. Such cells are specialized for lining the interior surface of blood vessels, providing a selective permeability barrier in bone vasculature."
chohgpek-1,endothelial cell.,nondisease,Femur,nondisease,Mouse,Xenium,"[Image Pair 7]: This endothelial cell, barely visible and flattened, features a thin nuclear profile suited for close apposition to the vascular lumen. It forms part of the vessel lining, facilitating exchange of nutrients and waste in the non-cancerous mouse femur."
