cell_id,cell-type,cell disease state,tissue,tissue disease state,source,st technology,caption
lcjabhcl-1,endothelial cell.,nondisease,Femur,nondisease,Mouse,Xenium,"[Image Pair 5]: The imaged non-cancerous endothelial cell from mouse femur, captured via Xenium spatial transcriptomics, displays an elongated morphology with attenuated cytoplasm. Endothelial cells line blood vessels, regulating vascular permeability, blood flow, and forming a barrier between circulating blood and the bone marrow tissue."
lcjcpfgh-1,erythrocyte.,nondisease,Femur,nondisease,Mouse,Xenium,"[Image Pair 6]: This non-cancerous erythrocyte cell, identified in the mouse femur by Xenium spatial transcriptomics, is small, anucleate, and exhibits a biconcave disc shape. Such morphology optimizes deformability and surface area for effective oxygen binding and delivery throughout the body."
lcjnefgm-1,megakaryocyte.,nondisease,Femur,nondisease,Mouse,Xenium,"[Image Pair 7]: The non-cancerous megakaryocyte from mouse femur, visualized using Xenium spatial transcriptomics, is a large cell with abundant cytoplasm and a multilobed, often polyploid nucleus. Megakaryocytes are responsible for producing platelets essential for blood clotting and vascular repair."
lclfaglp-1,neutrophil.,nondisease,Femur,nondisease,Mouse,Xenium,"[Image Pair 8]: This non-cancerous neutrophil cell from mouse femur, observed by Xenium spatial transcriptomics, is small and round, with a distinctly segmented nucleus. Neutrophils are key innate immune cells, rapidly mobilized to sites of infection for microbial defense within bone marrow and systemic tissue."
lcljfejm-1,monocyte.,nondisease,Femur,nondisease,Mouse,Xenium,"[Image Pair 9]: This non-cancerous monocyte cell, from mouse femur and visualized with Xenium spatial transcriptomics, is larger and has an oval or bean-shaped nucleus. Monocytes are precursors to macrophages and dendritic cells, involved in phagocytosis and immune regulation within bone marrow."
lcllebig-1,macrophage.,nondisease,Femur,nondisease,Mouse,Xenium,"[Image Pair 10]: The imaged non-cancerous macrophage from mouse femur, captured by Xenium spatial transcriptomics, is large and irregularly shaped with abundant cytoplasm and a variably shaped nucleus. Macrophages play critical roles in phagocytosis of debris and pathogens, as well as immune modulation in the bone marrow environment."
lcmbjlio-1,monocyte.,nondisease,Femur,nondisease,Mouse,Xenium,"[Image Pair 1]: This single cell is a non-cancerous monocyte from the bone marrow of a mouse femur, identified using Xenium spatial transcriptomics. Monocytes are large, round cells with an indented or kidney-shaped nucleus and abundant pale cytoplasm. In the bone marrow environment, they function as precursors to macrophages and dendritic cells, playing a key role in immune surveillance and phagocytosis."
lcmnogdb-1,monocyte.,nondisease,Femur,nondisease,Mouse,Xenium,"[Image Pair 2]: This image shows a non-cancerous monocyte from mouse femoral bone marrow, visualized with Xenium spatial transcriptomics. Monocytes are medium-to-large cells exhibiting a round to oval shape, with a lightly stained, eccentrically placed nucleus, and moderate cytoplasm. They are critical for innate immunity, migrating into tissues to differentiate into macrophages or dendritic cells."
lcoediej-1,monocyte.,nondisease,Femur,nondisease,Mouse,Xenium,"[Image Pair 3]: This cell is a non-cancerous monocyte located in the mouse femur, captured via Xenium spatial transcriptomics. Monocytes are large cells, typically round with a pale, kidney-shaped nucleus and fine cytoplasmic granularity. They serve as key components of the immune system by differentiating into macrophages or dendritic cells, supporting both phagocytic and antigen-presenting functions."
lcondnnl-1,neutrophil.,nondisease,Femur,nondisease,Mouse,Xenium,"[Image Pair 4]: This image displays a non-cancerous neutrophil from the mouse femoral bone marrow, analyzed with Xenium spatial transcriptomics. Neutrophils have a multi-lobed nucleus and finely granular cytoplasm, appearing round and smaller than monocytes. They are essential for innate immunity, rapidly responding to and destroying invading pathogens via phagocytosis and degranulation."
ldaocljk-1,neutrophil.,nondisease,Femur,nondisease,Mouse,Xenium,"[Image Pair 5]: This single cell is a non-cancerous neutrophil from mouse femoral bone marrow, revealed through Xenium spatial transcriptomics. Neutrophils are round with a segmented, multi-lobed nucleus and fine pink cytoplasmic granules. They function as the first line of defense against infection, capable of rapid migration and phagocytosis of microbes."
ldapifgd-1,macrophage.,nondisease,Femur,nondisease,Mouse,Xenium,"[Image Pair 6]: This is a non-cancerous macrophage cell in the mouse femur, identified by Xenium spatial transcriptomics. Macrophages are relatively large and often have an irregular or ovoid shape, with abundant cytoplasm and an eccentric, oval nucleus. They play a pivotal role in immune defense by engulfing pathogens and debris, orchestrating inflammatory responses, and presenting antigens to lymphocytes."
ldbfgfmg-1,monocyte.,nondisease,Femur,nondisease,Mouse,Xenium,"[Image Pair 7]: Shown here is a non-cancerous monocyte within the mouse femur, detected using Xenium spatial transcriptomics. Monocytes are characterized by a large, round to oval cell body with a pale, indented nucleus and ample cytoplasm. Their primary function is to circulate and migrate into tissues, where they differentiate into macrophages or dendritic cells as part of the immune response."
ldbnnfle-1,neutrophil.,nondisease,Femur,nondisease,Mouse,Xenium,"[Image Pair 8]: This single cell is a non-cancerous neutrophil in the mouse femur, visualized with Xenium spatial transcriptomics. Neutrophils are small to medium-sized, spherical cells featuring segmented, multi-lobed nuclei and faintly granular cytoplasm. As primary responders to infection, they mediate acute inflammation and directly ingest invading pathogens."
ldcandhf-1,monocyte.,nondisease,Femur,nondisease,Mouse,Xenium,"[Image Pair 9]: This image presents a non-cancerous monocyte in the mouse femoral bone marrow, discerned via Xenium spatial transcriptomics. Monocytes are large, with an irregular, kidney-shaped nucleus and pale cytoplasm, serving as a migratory precursor to phagocytic macrophages and dendritic cells essential for innate and adaptive immunity."
lgifpecf-1,megakaryocyte-erythroid progenitor cell.,nondisease,Femur,nondisease,Mouse,Xenium,"[Image Pair 10]: This is a non-cancerous megakaryocyte-erythroid progenitor cell from the mouse femur, identified by Xenium spatial transcriptomics. These progenitors exhibit an intermediate size, high nucleus-to-cytoplasm ratio, and an oval or irregular nucleus. They differentiate into megakaryocytes, which produce platelets, or erythrocytes, and are critical for maintaining blood cell homeostasis."
lgilojkc-1,endothelial cell.,nondisease,Femur,nondisease,Mouse,Xenium,"[Image Pair 1]: The single non-cancerous endothelial cell from mouse femur shows a small, elongated or oval shape with a centrally located nucleus and scant cytoplasm. Endothelial cells form the inner lining of blood vessels, maintaining vascular barrier function and regulating exchange of substances between blood and bone marrow."
lgjdbgmk-1,endothelial cell.,nondisease,Femur,nondisease,Mouse,Xenium,"[Image Pair 2]: This non-cancerous endothelial cell from the mouse femur exhibits a flattened and elongated morphology with a dense, centrally positioned nucleus. Endothelial cells are critical for lining blood vessels and regulating vascular permeability within the bone marrow microenvironment."
lgjhpbdk-1,megakaryocyte.,nondisease,Femur,nondisease,Mouse,Xenium,"[Image Pair 3]: The non-cancerous megakaryocyte from mouse femur is a large, irregularly shaped cell with abundant cytoplasm and a multilobed or polylobate nucleus. Megakaryocytes are essential for platelet production, releasing platelets into the bloodstream to support hemostasis."
lgkdiogj-1,neutrophil.,nondisease,Femur,nondisease,Mouse,Xenium,"[Image Pair 4]: This non-cancerous neutrophil from mouse femur displays a small, round cell body with a distinct multilobed nucleus and minimal cytoplasm. Neutrophils are key innate immune cells, specialized for rapid response to infection through phagocytosis and degranulation."
lgkimjlm-1,endothelial cell.,nondisease,Femur,nondisease,Mouse,Xenium,"[Image Pair 5]: The non-cancerous endothelial cell in the mouse femur is small, oval, and flattened, with a central nucleus and thin cytoplasm. These cells line the interior surface of blood vessels, facilitating selective transport and maintaining hematopoietic tissue homeostasis."
lgnjhemk-1,neutrophil.,nondisease,Femur,nondisease,Mouse,Xenium,"[Image Pair 6]: The single non-cancerous neutrophil in mouse femur features a segmented, multilobed nucleus and a compact, round cell shape. Neutrophils serve as frontline responders in innate immunity, rapidly migrating to sites of infection and engulfing pathogens."
lhaacffp-1,macrophage.,nondisease,Femur,nondisease,Mouse,Xenium,"[Image Pair 7]: The non-cancerous macrophage in mouse femur is moderately large and irregular, with abundant cytoplasm and an eccentric, oval-shaped nucleus. Macrophages are vital for phagocytosis, clearing cellular debris, and orchestrating immune responses in the bone marrow niche."
lhapadok-1,monocyte.,nondisease,Femur,nondisease,Mouse,Xenium,"[Image Pair 8]: This non-cancerous monocyte from mouse femur appears large and oval with a kidney-shaped nucleus and ample cytoplasm. Monocytes circulate as precursors to macrophages or dendritic cells and play a crucial role in inflammation, tissue repair, and immune surveillance."
lhblkpfo-1,megakaryocyte.,nondisease,Femur,nondisease,Mouse,Xenium,"[Image Pair 9]: The non-cancerous megakaryocyte in the mouse femur displays very large size, irregular borders, and a multilobed, hyperchromatic nucleus. These cells are responsible for the generation of platelets by shedding cytoplasmic fragments into the bone marrow sinusoids."
lhdmkaom-1,monocyte.,nondisease,Femur,nondisease,Mouse,Xenium,"[Image Pair 10]: This non-cancerous monocyte from the mouse femur is characterized by a relatively large, oval to kidney-shaped nucleus and extensive cytoplasm. Monocytes differentiate into macrophages or dendritic cells after entering tissues, contributing to immune defense and tissue remodeling."
lhgdmgic-1,monocyte.,nondisease,Femur,nondisease,Mouse,Xenium,"[Image Pair 1]: This single cell is a non-cancerous monocyte from the mouse femur, as revealed by Xenium spatial transcriptomics. Monocytes are medium-sized cells with an oval or kidney-shaped nucleus and abundant pale cytoplasm, functioning as precursor cells that migrate into tissues and differentiate into macrophages or dendritic cells, playing key roles in immune surveillance and response."
lhgdpoie-1,megakaryocyte.,nondisease,Femur,nondisease,Mouse,Xenium,"[Image Pair 2]: This single cell is a non-cancerous megakaryocyte in the mouse femur, observed via Xenium spatial transcriptomics. Megakaryocytes are notably large with multilobulated nuclei and granular cytoplasm, responsible for the production of platelets essential for blood coagulation within the bone marrow."
lhigjfpc-1,monocyte.,nondisease,Femur,nondisease,Mouse,Xenium,"[Image Pair 3]: This single cell is a non-cancerous monocyte from the mouse femur, imaged with Xenium spatial transcriptomics. The monocyte exhibits a round to oval morphology, with a relatively large, kidney-shaped nucleus and moderate cytoplasm, serving as an immune effector that can differentiate into macrophages for host defense."
lhjehghk-1,erythrocyte.,nondisease,Femur,nondisease,Mouse,Xenium,"[Image Pair 4]: This single cell is a non-cancerous erythrocyte located in the mouse femur, detected using Xenium spatial transcriptomics. Erythrocytes are small, biconcave, anucleate cells with a uniform pink staining, specialized for efficient oxygen transport throughout the body due to their flexible, disc-like shape and high hemoglobin content."
lhjijoin-1,macrophage.,nondisease,Femur,nondisease,Mouse,Xenium,"[Image Pair 5]: This single cell is a non-cancerous macrophage in the mouse femur, visualized by Xenium spatial transcriptomics. Macrophages are relatively large cells with irregular or oval shapes, abundant cytoplasm, and an eccentric nucleus, functioning as phagocytes in the clearance of pathogens, cellular debris, and for orchestrating immune responses."
lhjpglan-1,macrophage.,nondisease,Femur,nondisease,Mouse,Xenium,"[Image Pair 6]: This single cell is a non-cancerous macrophage from the mouse femur visualized by Xenium spatial transcriptomics. Macrophages are large, variably shaped cells with a well-defined nucleus and abundant cytoplasm, acting as critical immune system components by engulfing pathogens and presenting antigens to lymphocytes."
lhkceiic-1,endothelial cell.,nondisease,Femur,nondisease,Mouse,Xenium,"[Image Pair 7]: This single cell is a non-cancerous endothelial cell from the mouse femur, identified via Xenium spatial transcriptomics. Endothelial cells are thin, elongated cells with flattened nuclei, forming a monolayer lining the lumen of blood vessels, and regulating vascular permeability, blood flow, and exchange of substances between bloodstream and surrounding tissue."
lhlglnoi-1,megakaryocyte.,nondisease,Femur,nondisease,Mouse,Xenium,"[Image Pair 8]: This single cell is a non-cancerous megakaryocyte in the mouse femur, revealed by Xenium spatial transcriptomics. Megakaryocytes are exceptionally large marrow cells with lobulated, polyploid nuclei and copious cytoplasm, serving as the source of circulating platelets necessary for hemostasis."
lhlheggk-1,erythrocyte.,nondisease,Femur,nondisease,Mouse,Xenium,"[Image Pair 9]: This single cell is a non-cancerous erythrocyte located in the mouse femur, observed via Xenium spatial transcriptomics. Erythrocytes are small, anucleate cells with a biconcave disk shape, specialized for the efficient transport of oxygen and carbon dioxide in the bloodstream."
lhnfeaeg-1,cardiac endothelial cell.,nondisease,Femur,nondisease,Mouse,Xenium,"[Image Pair 10]: This single cell is a non-cancerous cardiac endothelial cell in the mouse femur, visualized by Xenium spatial transcriptomics. Cardiac endothelial cells are elongated and flattened, forming a continuous lining along the blood vessel lumen and mediating vascular barrier function, nutrient exchange, and regulation of vascular tone within the bone marrow microenvironment."
lhnicegn-1,cardiac muscle myoblast.,nondisease,Femur,nondisease,Mouse,Xenium,"[Image Pair 1]: This non-cancerous cardiac muscle myoblast displays an elongated, spindle-shaped morphology with a centrally located nucleus and abundant eosinophilic cytoplasm. These cells are precursors to cardiac myocytes, responsible for generating contractile force, and show characteristic striations essential for organized contraction in heart tissue; here, they are visualized in mouse femur using Xenium spatial transcriptomics."
lhogkoff-1,erythroid lineage cell.,nondisease,Femur,nondisease,Mouse,Xenium,"[Image Pair 2]: The erythroid lineage cell is small and round with a high nuclear-to-cytoplasmic ratio, featuring deeply basophilic cytoplasm and a dense, centrally placed nucleus. These precursor cells give rise to mature red blood cells, playing a key role in oxygen transport within the mouse femur as revealed using Xenium spatial transcriptomics."
licngjke-1,neutrophil.,nondisease,Femur,nondisease,Mouse,Xenium,"[Image Pair 3]: This neutrophil exhibits a multi-lobed, segmented nucleus and granular, pale cytoplasm. As a key component of the innate immune system, neutrophils are designed for rapid response and phagocytosis of pathogens in the bone marrow, as shown in the mouse femur with Xenium spatial transcriptomics."
lidondgk-1,erythrocyte.,nondisease,Femur,nondisease,Mouse,Xenium,"[Image Pair 4]: The non-cancerous erythrocyte, or mature red blood cell, appears as a small, round, anucleate cell with homogenous eosinophilic cytoplasm. Its biconcave shape increases surface area for efficient gas exchange, crucial for oxygen transport in the mouse femur as visualized with Xenium spatial transcriptomics."
lieghicd-1,neutrophil.,nondisease,Femur,nondisease,Mouse,Xenium,"[Image Pair 5]: This neutrophil is identified by its segmented nucleus and lightly granular cytoplasm. Specialized for fast migration and antimicrobial action, neutrophils help defend against infection in the mouse femur, as captured using Xenium spatial transcriptomics."
liehnoao-1,macrophage.,nondisease,Femur,nondisease,Mouse,Xenium,"[Image Pair 6]: The macrophage presents as a large, irregularly shaped cell with abundant cytoplasm and a round to oval, eccentrically placed nucleus. These cells engage in phagocytosis and immune modulation, supporting tissue homeostasis in mouse femur as revealed by Xenium spatial transcriptomics."
lifbgdij-1,neutrophil.,nondisease,Femur,nondisease,Mouse,Xenium,"[Image Pair 7]: The cell morphology shows a neutrophil, distinguished by its multi-lobed nucleus and faintly granular cytoplasm. These innate immune cells are efficient at migrating to infection sites and engulfing pathogens, as visualized in the mouse femur using Xenium spatial transcriptomics."
lifcgblk-1,macrophage.,nondisease,Femur,nondisease,Mouse,Xenium,"[Image Pair 8]: This macrophage displays a large, oval shape with a prominent, eccentrically placed nucleus and vacuolated cytoplasm. Responsible for phagocytosis and immune regulation, macrophages maintain bone marrow health, as imaged in a non-cancerous mouse femur with Xenium spatial transcriptomics."
lifchkfk-1,neutrophil.,nondisease,Femur,nondisease,Mouse,Xenium,"[Image Pair 9]: The depicted cell is a neutrophil, characterized by a segmented nucleus and scant, lightly granular cytoplasm. It functions in the rapid clearance of pathogens by phagocytosis within bone marrow tissue, as visualized with Xenium spatial transcriptomics in the mouse femur."
liffkifh-1,neutrophil.,nondisease,Femur,nondisease,Mouse,Xenium,"[Image Pair 10]: This neutrophil features a multi-lobed nucleus and faintly granular cytoplasm, consistent with its role in the swift innate immune response and phagocytosis of microbes, as seen in the healthy mouse femur via Xenium spatial transcriptomics."
lifliale-1,monocyte.,nondisease,Femur,nondisease,Mouse,Xenium,"[Image Pair 1]: This single cell is a non-cancerous monocyte from the mouse femur, exhibiting an oval to bean-shaped nucleus with sparse cytoplasm. Monocytes are medium-to-large cells with diameters of 15–20 μm, serving as precursors to macrophages and dendritic cells, and are essential for phagocytosis and immune surveillance within the bone marrow microenvironment."
ligdadnh-1,neutrophil.,nondisease,Femur,nondisease,Mouse,Xenium,"[Image Pair 2]: This non-cancerous neutrophil from mouse femur displays a characteristic multi-lobed nucleus and granular cytoplasm, typical of small, round cells (10–12 μm). As key players in innate immunity, neutrophils rapidly respond to infection by migrating to sites of inflammation and performing phagocytosis of pathogens."
lihjbimh-1,megakaryocyte.,nondisease,Femur,nondisease,Mouse,Xenium,"[Image Pair 3]: This non-cancerous megakaryocyte is a large cell found in the mouse femur, characterized by a massive, lobulated nucleus and abundant granular cytoplasm. Megakaryocytes are responsible for the production of platelets, and their large size and complex nuclear structure distinguish them from other hematopoietic cells."
lihpdjjo-1,macrophage.,nondisease,Femur,nondisease,Mouse,Xenium,"[Image Pair 4]: This non-cancerous macrophage from the mouse femur is a large, irregularly shaped cell with abundant cytoplasm and an often oval or kidney-shaped nucleus. Macrophages function in phagocytosis and antigen presentation, playing a vital role in tissue remodeling and immune defense within the bone marrow."
liiijmkc-1,macrophage.,nondisease,Femur,nondisease,Mouse,Xenium,"[Image Pair 5]: This non-cancerous macrophage from mouse femur is identifiable by its relatively large size, abundant pale cytoplasm, and irregular nuclear contours. Functionally, these cells engulf debris and pathogens and orchestrate immune responses in the bone marrow."
lijbjldm-1,monocyte.,nondisease,Femur,nondisease,Mouse,Xenium,"[Image Pair 6]: This non-cancerous monocyte from mouse femur is an intermediate-sized cell with a kidney-shaped nucleus and limited cytoplasm, specializing in phagocytosis and differentiation into tissue macrophages and dendritic cells for immune regulation."
lijndpjm-1,neutrophil.,nondisease,Femur,nondisease,Mouse,Xenium,"[Image Pair 7]: This non-cancerous neutrophil from mouse femur features a segmented nucleus and faintly granular cytoplasm, adapting the cell for rapid chemotaxis and microbial killing as part of the first line of immune defense."
lilmjbkg-1,bladder cell.,nondisease,Femur,nondisease,Mouse,Xenium,"[Image Pair 8]: This non-cancerous bladder cell, seen in the context of the mouse femur, is polygonal with a moderate amount of cytoplasm and centrally located nucleus. Bladder (urothelial) cells line the urinary tract and are rare in femur samples, possibly reflecting specimen contamination or migration."
limnnccd-1,neutrophil.,nondisease,Femur,nondisease,Mouse,Xenium,"[Image Pair 9]: This non-cancerous neutrophil from the mouse femur is a small cell with a segmented, dense nucleus and pale cytoplasm, specialized for rapid response to infection and tissue injury through migration and phagocytosis."
lionekgh-1,endothelial cell.,nondisease,Femur,nondisease,Mouse,Xenium,"[Image Pair 10]: This non-cancerous endothelial cell from the mouse femur is elongated and flattened, with a thin cytoplasmic rim and oval nucleus. Endothelial cells line blood vessels, regulating vascular permeability and facilitating exchange between blood and bone marrow tissue."
ljahmcan-1,megakaryocyte.,nondisease,Femur,nondisease,Mouse,Xenium,"[Image Pair 1]: This non-cancerous megakaryocyte, visualized from mouse femur marrow using Xenium spatial transcriptomics, is a large, irregularly shaped cell with abundant granular cytoplasm. It features a multilobed or polyploid nucleus, critical for the production of platelets which are essential for blood clotting."
ljbedehn-1,megakaryocyte.,nondisease,Femur,nondisease,Mouse,Xenium,"[Image Pair 2]: This non-cancerous megakaryocyte from the mouse femur exhibits a massive cell body with plentiful cytoplasm and a large, multilobulated nucleus. Megakaryocytes are responsible for generating platelets, supporting hemostasis within the bone marrow environment."
ljcedlak-1,monocyte.,nondisease,Femur,nondisease,Mouse,Xenium,"[Image Pair 3]: This non-cancerous monocyte, isolated from mouse femur marrow, is medium to large in size and displays an indented or kidney-shaped nucleus with ample pale blue cytoplasm. Monocytes serve as precursor cells to macrophages and dendritic cells, vital for immune surveillance and phagocytosis."
ljcokjjg-1,neutrophil.,nondisease,Femur,nondisease,Mouse,Xenium,"[Image Pair 4]: This non-cancerous neutrophil, located in the mouse femur, is characterized by a segmented, multi-lobed nucleus and dense, faintly granular cytoplasm. Neutrophils act as first responders in innate immunity, targeting and destroying pathogens via phagocytosis and degranulation."
ljdfphga-1,macrophage.,nondisease,Femur,nondisease,Mouse,Xenium,"[Image Pair 5]: This non-cancerous macrophage from the mouse femur presents as a large cell with an oval or kidney-shaped nucleus and a substantial cytoplasm. Macrophages are professional phagocytes, crucial for engulfing pathogens, cellular debris, and supporting tissue homeostasis."
ljdihkel-1,macrophage.,nondisease,Femur,nondisease,Mouse,Xenium,"[Image Pair 6]: This non-cancerous macrophage within mouse femur marrow demonstrates a large, often irregular outline, with a voluminous cytoplasm and an eccentric, oval nucleus. As part of the mononuclear phagocyte system, these cells orchestrate immune responses and clear apoptotic debris."
ljflfpec-1,endothelial cell.,nondisease,Femur,nondisease,Mouse,Xenium,"[Image Pair 7]: This non-cancerous endothelial cell, situated in the mouse femur, exhibits an elongated, flattened morphology aligning along the blood vessel wall. Endothelial cells form the vascular lining and regulate the passage of substances and immune cells between blood and tissues."
ljgecnnm-1,monocyte.,nondisease,Femur,nondisease,Mouse,Xenium,"[Image Pair 8]: This non-cancerous monocyte depicted from the mouse femur is medium-sized, with a bean-shaped or indented nucleus and ample light cytoplasm. Monocytes differentiate into macrophages or dendritic cells and are pivotal in both innate immunity and tissue repair."
ljhdoapd-1,macrophage.,nondisease,Femur,nondisease,Mouse,Xenium,"[Image Pair 9]: This non-cancerous macrophage, visualized from mouse femur, is a large cell with an eccentrically located, round to oval nucleus and abundant, lightly granular cytoplasm. These cells perform critical roles in phagocytosis, antigen presentation, and tissue remodeling."
ljidnnop-1,endothelial cell.,nondisease,Femur,nondisease,Mouse,Xenium,"[Image Pair 10]: This non-cancerous endothelial cell from the mouse femur displays a slender, tapering shape and forms a thin lining along vascular surfaces. Endothelial cells maintain vascular barrier integrity and mediate selective exchange of molecules and immune cell trafficking."
