cell_id,cell-type,cell disease state,tissue,tissue disease state,source,st technology,caption
jdlhlole-1,monocyte.,nondisease,Femur,nondisease,Mouse,Xenium,"[Image Pair 9]: This image features a non-cancerous monocyte from the mouse femur, identified by its large size, prominent cytoplasm, and kidney-shaped nucleus. Monocytes act as precursors to macrophages and dendritic cells, specializing in phagocytosis and antigen presentation within tissues."
jdmiacgn-1,erythroid lineage cell.,nondisease,Femur,nondisease,Mouse,Xenium,"[Image Pair 10]: This image shows a non-cancerous erythroid lineage cell from the mouse femur, characterized by its small, round shape and intensely basophilic nucleus. These cells are maturing erythrocyte precursors, essential for the continual replenishment of red blood cells that transport oxygen in circulation."
jdmojmnd-1,erythrocyte.,nondisease,Femur,nondisease,Mouse,Xenium,"[Image Pair 1]: This single cell is a non-cancerous erythrocyte from the mouse femur, visualized with Xenium spatial transcriptomics. Erythrocytes are small, anucleate, biconcave discs, optimizing surface area for efficient gas exchange. In marrow tissue, they lack visible nuclei and appear as pale pink, round cells, essential for oxygen transport throughout the body."
jdnlnkah-1,neutrophil.,nondisease,Femur,nondisease,Mouse,Xenium,"[Image Pair 2]: This image depicts a non-cancerous neutrophil from the mouse femur, acquired using Xenium spatial transcriptomics. Neutrophils are medium-sized, round leukocytes characterized by multilobed nuclei and granular cytoplasm. These cells play a crucial role in immune defense by phagocytosing pathogens and mediating acute inflammatory responses."
jdplmapj-1,megakaryocyte.,nondisease,Femur,nondisease,Mouse,Xenium,"[Image Pair 3]: Shown here is a non-cancerous megakaryocyte from the mouse femur, imaged with Xenium spatial transcriptomics. Megakaryocytes are the largest marrow cells, with an irregular shape, abundant cytoplasm, and a multilobed or polyploid nucleus. These cells generate platelets, which are vital for blood clotting and vascular repair."
jeacgbnm-1,erythrocyte.,nondisease,Femur,nondisease,Mouse,Xenium,"[Image Pair 4]: This image features a non-cancerous erythrocyte from the mouse femur, as captured with Xenium spatial transcriptomics. Erythrocytes are small, anucleate, and exhibit a biconcave shape, appearing pale pink and circular. Their primary function is oxygen delivery, facilitated by their unique morphology."
jeaimcpo-1,neutrophil.,nondisease,Femur,nondisease,Mouse,Xenium,"[Image Pair 5]: This single cell is a non-cancerous neutrophil from the mouse femur, imaged by Xenium spatial transcriptomics. Neutrophils display a segmented, multi-lobed nucleus and granular cytoplasm. Their primary function is to neutralize infections through phagocytosis and release of antimicrobial compounds during acute inflammation."
jealhajo-1,neutrophil.,nondisease,Femur,nondisease,Mouse,Xenium,"[Image Pair 6]: Depicted is a non-cancerous neutrophil in the mouse femur, visualized via Xenium spatial transcriptomics. Neutrophils are round leukocytes with distinctive segmented nuclei and fine cytoplasmic granules, essential for innate immune responses and rapid targeting of pathogens at sites of injury."
jebihanb-1,erythrocyte.,nondisease,Femur,nondisease,Mouse,Xenium,"[Image Pair 7]: This single cell is a non-cancerous erythrocyte from the mouse femur, visualized using Xenium spatial transcriptomics. Erythrocytes are small, anucleate, biconcave discs that appear as round pink cells without nuclei, optimized for maximal oxygen-carrying capacity in the bloodstream."
jedkkedm-1,macrophage.,nondisease,Femur,nondisease,Mouse,Xenium,"[Image Pair 8]: Displayed is a non-cancerous macrophage from the mouse femur, captured with Xenium spatial transcriptomics. Macrophages are large, irregularly shaped cells with abundant cytoplasm and a centrally located nucleus, functioning in phagocytosis, antigen presentation, and immune regulation within bone marrow."
jefjdmkc-1,megakaryocyte.,nondisease,Femur,nondisease,Mouse,Xenium,"[Image Pair 9]: This image presents a non-cancerous megakaryocyte from the mouse femur, visualized by Xenium spatial transcriptomics. Megakaryocytes are notably large cells with lobulated, polyploid nuclei and ample cytoplasm, producing platelets that are essential for hemostasis and tissue repair."
jefmljni-1,neutrophil.,nondisease,Femur,nondisease,Mouse,Xenium,"[Image Pair 10]: Shown here is a non-cancerous neutrophil from the mouse femur, acquired using Xenium spatial transcriptomics. Neutrophils are medium-sized cells with a multilobed nucleus and granular cytoplasm, mediating rapid, front-line defense against microbial invasion through phagocytosis and degranulation."
jefpekmm-1,neutrophil.,nondisease,Femur,nondisease,Mouse,Xenium,"[Image Pair 1]: This single cell is a neutrophil, identified in non-cancerous mouse femur tissue using Xenium spatial transcriptomics. Neutrophils are medium-sized cells with a segmented, multi-lobed nucleus and granular cytoplasm, which assist in the rapid phagocytosis and destruction of pathogens as part of the innate immune response. The surrounding tissue shows normal hematopoietic cellularity, typical of healthy bone marrow."
jeganhil-1,macrophage.,nondisease,Femur,nondisease,Mouse,Xenium,"[Image Pair 2]: This single cell is a macrophage within non-cancerous mouse femur tissue imaged via Xenium technology. Macrophages are large, irregular-shaped cells featuring abundant cytoplasm and a round to oval nucleus. They function as professional phagocytes, engulfing cellular debris and pathogens while orchestrating inflammatory and reparative responses in the bone marrow microenvironment."
jegpjdhb-1,erythrocyte.,nondisease,Femur,nondisease,Mouse,Xenium,"[Image Pair 3]: This single cell is an erythrocyte from healthy mouse femur marrow, visualized with Xenium spatial transcriptomics. Erythrocytes are biconcave, anucleate, and relatively small cells, appearing pale with little internal structure. Their primary function is oxygen and carbon dioxide transport through hemoglobin, essential for efficient gas exchange throughout the organism."
jehddjge-1,megakaryocyte.,nondisease,Femur,nondisease,Mouse,Xenium,"[Image Pair 4]: This single cell is a megakaryocyte, observed in non-cancerous mouse femur using Xenium spatial transcriptomics. Megakaryocytes are exceptionally large cells with abundant cytoplasm and a multilobulated nucleus. Their primary function is the production and release of platelets into the bloodstream, playing a crucial role in hemostasis."
jehhmhad-1,megakaryocyte.,nondisease,Femur,nondisease,Mouse,Xenium,"[Image Pair 5]: This single cell is a megakaryocyte from non-cancerous mouse femur tissue, visualized by Xenium technology. Megakaryocytes are characterized by their massive cell size and multilobed nucleus, with granular cytoplasm where platelets bud off. They are essential for platelet generation in the bone marrow, critical for blood clotting."
jeiedkbe-1,monocyte.,nondisease,Femur,nondisease,Mouse,Xenium,"[Image Pair 6]: This single cell is a monocyte, located in non-cancerous mouse femur tissue and imaged with Xenium spatial transcriptomics. Monocytes are large, round to oval cells with abundant pale cytoplasm and a kidney-shaped nucleus. They act as precursors to macrophages and dendritic cells, circulating to sites of inflammation and contributing to innate immunity and tissue remodeling."
jejcdigk-1,endothelial cell.,nondisease,Femur,nondisease,Mouse,Xenium,"[Image Pair 7]: This single cell is an endothelial cell within healthy mouse femur, detected with Xenium technology. Endothelial cells are elongated and flattened, forming the lining of blood vessels. Their central, oval nuclei and thin cytoplasm facilitate regulation of vascular permeability and blood cell trafficking within the bone marrow."
jejooofj-1,macrophage.,nondisease,Femur,nondisease,Mouse,Xenium,"[Image Pair 8]: This single cell is a macrophage from non-cancerous mouse femur tissue, analyzed with Xenium spatial transcriptomics. Macrophages display a large, irregular contour with ample cytoplasm and a round to oval nucleus, functioning as key phagocytic cells involved in debris clearance, immune regulation, and tissue homeostasis."
jekjkoal-1,endothelial cell.,nondisease,Femur,nondisease,Mouse,Xenium,"[Image Pair 9]: This single cell is an endothelial cell in non-cancerous mouse femur, imaged using Xenium technology. Endothelial cells are thin, elongated, and line the marrow vasculature, facilitating selective exchange of nutrients and cells between blood and hematopoietic tissue, while maintaining vascular integrity."
jelcafma-1,neutrophil.,nondisease,Femur,nondisease,Mouse,Xenium,"[Image Pair 10]: This single cell is a neutrophil, present in the non-cancerous mouse femur and captured using Xenium spatial transcriptomics. Neutrophils are medium-sized, round cells with a distinctive multilobed nucleus and granular cytoplasm, serving as first responders to infection and mediating rapid innate immune defense in the bone marrow."
jemoggjl-1,megakaryocyte.,nondisease,Femur,nondisease,Mouse,Xenium,"[Image Pair 1]: This large, non-cancerous megakaryocyte displays an expansive, lobulated nucleus and abundant granular cytoplasm, typical of its specialized role in platelet production within the mouse femur. The prominent nucleus and irregular cell boundary distinguish megakaryocytes from hematopoietic precursors observed in bone marrow."
jenbhbap-1,neutrophil.,nondisease,Femur,nondisease,Mouse,Xenium,"[Image Pair 2]: This non-cancerous neutrophil exhibits a small, segmented nucleus and pale, granular cytoplasm, reflecting its role as a key phagocytic cell in innate immune defense within the mouse femur bone marrow."
jeninehc-1,neutrophil.,nondisease,Femur,nondisease,Mouse,Xenium,"[Image Pair 3]: This neutrophil is a small cell characterized by a multi-lobed nucleus and faint cytoplasmic granules, attributes that support its rapid migration and pathogen-clearing functions in the mouse femur bone marrow."
jeofgefn-1,myeloid cell.,nondisease,Femur,nondisease,Mouse,Xenium,"[Image Pair 4]: This non-cancerous myeloid cell is medium-sized with an irregular nucleus and finely granular cytoplasm, reflecting its developmental stage and role as a precursor to mature myeloid immune cells in the mouse femur."
jfaabjom-1,monocyte.,nondisease,Femur,nondisease,Mouse,Xenium,"[Image Pair 5]: This monocyte is a large cell with an indented or kidney-shaped nucleus and abundant, mildly granular cytoplasm, signifying its capacity for migration and differentiation into macrophages or dendritic cells in the mouse femur marrow."
jfafccai-1,immature innate lymphoid cell.,nondisease,Femur,nondisease,Mouse,Xenium,"[Image Pair 6]: The immature innate lymphoid cell is small and round, with a high nuclear-to-cytoplasmic ratio and scant granules, suited for early development and rapid immune signaling in the mouse femur marrow."
jfbhhggn-1,fibroblast.,nondisease,Femur,nondisease,Mouse,Xenium,"[Image Pair 7]: This fibroblast features an elongated, spindle-shaped morphology with a flattened nucleus and scant cytoplasm, well adapted for synthesizing extracellular matrix and supporting the stromal environment of the mouse femur."
jfgbnnig-1,macrophage.,nondisease,Femur,nondisease,Mouse,Xenium,"[Image Pair 8]: This macrophage is a large, round cell with an eccentrically placed, oval nucleus and abundant vacuolated cytoplasm, adapted for phagocytosis and immune surveillance in the mouse femur bone marrow."
jfhdgeoa-1,neutrophil.,nondisease,Femur,nondisease,Mouse,Xenium,"[Image Pair 9]: The neutrophil in this image has a distinct, segmented nucleus and pale cytoplasm with small granules, indicating its specialized function in acute inflammatory responses within the mouse femur marrow."
jfhgapib-1,erythroblast.,nondisease,Femur,nondisease,Mouse,Xenium,"[Image Pair 10]: This erythroblast is a round precursor cell with a densely staining, centrally located nucleus and modest basophilic cytoplasm, designed for hemoglobin synthesis and maturation toward a functional erythrocyte in mouse femur bone marrow."
jfhlkgaf-1,fibroblast.,nondisease,Femur,nondisease,Mouse,Xenium,"[Image Pair 1]: This non-cancerous fibroblast cell from the mouse femur exhibits a spindle-shaped morphology with elongated, tapering cytoplasmic extensions and an oval nucleus. Fibroblasts are pivotal for synthesizing and remodeling the extracellular matrix, contributing to bone tissue structure and repair. The surrounding histopathology patch shows pink-staining collagen fibers aligned parallel to the fibroblast, indicating active matrix production."
jfkigfap-1,endothelial cell.,nondisease,Femur,nondisease,Mouse,Xenium,"[Image Pair 2]: This non-cancerous endothelial cell from the mouse femur displays a flattened, elongated shape consistent with its role lining blood vessels. Endothelial cells mediate vascular barrier function, regulate blood flow, and facilitate exchange between blood and bone tissue. The histopathology patch presents the endothelial layer at vessel boundaries adjacent to dense bone matrix."
jfkmmhob-1,endothelial cell.,nondisease,Femur,nondisease,Mouse,Xenium,"[Image Pair 3]: This non-cancerous endothelial cell, observed in the mouse femur, exhibits a thin, elongated morphology typical of cells lining vascular surfaces. The cell’s flattened profile and central nucleus help maintain selective permeability and vascular integrity, as seen adjacent to the bone matrix and hematopoietic compartments in the tissue section."
jfllpjgc-1,megakaryocyte.,nondisease,Femur,nondisease,Mouse,Xenium,"[Image Pair 4]: This non-cancerous megakaryocyte from the mouse femur is a large, round cell with abundant cytoplasm and a multilobulated nucleus. Megakaryocytes function as precursors to platelets, playing a vital role in hemostasis. The histopathology patch reveals these cells embedded in the hematopoietic marrow, surrounded by smaller precursor cells."
jfmbpljc-1,megakaryocyte.,nondisease,Femur,nondisease,Mouse,Xenium,"[Image Pair 5]: This non-cancerous megakaryocyte in the mouse femur shows a very large size and lobulated nucleus, distinguishing it from neighboring hematopoietic cells. Its extensive cytoplasm is indicative of platelet formation, crucial for normal blood clotting within the bone marrow environment."
jfmjcmck-1,megakaryocyte.,nondisease,Femur,nondisease,Mouse,Xenium,"[Image Pair 6]: This megakaryocyte, located in non-cancerous mouse femur tissue, has a prominent large, polyploid nucleus and abundant granular cytoplasm. Such morphology supports its function in thrombopoiesis, where cytoplasmic fragments give rise to circulating platelets."
jfnokkod-1,fibroblast.,nondisease,Femur,nondisease,Mouse,Xenium,"[Image Pair 7]: This non-cancerous fibroblast from mouse femur is spindle-shaped with elongated cytoplasmic processes and an oval nucleus. Fibroblasts synthesize extracellular matrix components, supporting bone integrity and providing a scaffolding for hematopoietic and stromal elements in the marrow."
jfpfndnm-1,megakaryocyte.,nondisease,Femur,nondisease,Mouse,Xenium,"[Image Pair 8]: This non-cancerous megakaryocyte from the mouse femur bone marrow is notably large with a lobulated nucleus and expansive cytoplasm, essential for producing platelets. It is surrounded by densely packed hematopoietic cells, reflecting its specialized role in blood cell development."
jfpjmgon-1,erythroblast.,nondisease,Femur,nondisease,Mouse,Xenium,"[Image Pair 9]: This erythroblast from the mouse femur is a small, round cell with dense, basophilic cytoplasm and a centrally placed, round nucleus. Erythroblasts are precursors to mature red blood cells and are typically seen in active hematopoietic bone marrow, where they participate in erythropoiesis."
jgakeajo-1,neutrophil.,nondisease,Femur,nondisease,Mouse,Xenium,"[Image Pair 10]: This neutrophil from the non-cancerous mouse femur is characterized by its multilobed nucleus and granular cytoplasm. Neutrophils are essential for innate immunity, rapidly responding to infection and inflammation within the bone marrow and peripheral tissues."
jgclkcpb-1,macrophage.,nondisease,Femur,nondisease,Mouse,Xenium,"[Image Pair 1]: This single cell is a non-cancerous macrophage from mouse femur, displaying an irregular, amoeboid shape with abundant pale cytoplasm and an eccentrically placed nucleus. Macrophages are large phagocytic cells that play a crucial role in removing debris and pathogens, as well as orchestrating immune responses within the bone marrow tissue."
jgdeceij-1,erythrocyte.,nondisease,Femur,nondisease,Mouse,Xenium,"[Image Pair 2]: This single cell is a non-cancerous erythrocyte from mouse femur, characterized by its small, round, biconcave disc shape and lack of a nucleus. Erythrocytes are specialized for efficient gas exchange, enabling oxygen transport from the lungs to tissues throughout the body."
jgdlhgig-1,macrophage.,nondisease,Femur,nondisease,Mouse,Xenium,"[Image Pair 3]: This single cell is a non-cancerous macrophage from mouse femur, exhibiting a large, irregular contour with abundant cytoplasm and a slightly eccentric nucleus. Macrophages actively phagocytose cellular debris and pathogens, contributing to tissue homeostasis and immune defense in bone marrow."
jgfopokl-1,monocyte.,nondisease,Femur,nondisease,Mouse,Xenium,"[Image Pair 4]: This single cell is a non-cancerous monocyte from mouse femur, displaying an oval to kidney-shaped nucleus with ample pale cytoplasm. Monocytes circulate as precursors to macrophages and dendritic cells, serving key roles in immune surveillance and inflammation."
jghdheja-1,monocyte.,nondisease,Femur,nondisease,Mouse,Xenium,"[Image Pair 5]: This single cell is a non-cancerous monocyte from mouse femur, featuring a moderate size, kidney-shaped nucleus, and lightly stained cytoplasm. Monocytes are essential for immune defense, differentiating into macrophages or dendritic cells upon tissue infiltration."
jgiogmfa-1,monocyte.,nondisease,Femur,nondisease,Mouse,Xenium,"[Image Pair 6]: This single cell is a non-cancerous monocyte from mouse femur, noted by its relatively large size and bean-shaped nucleus. Monocytes act as critical regulators of immune responses, providing progenitors for macrophages and dendritic cells within the bone marrow microenvironment."
jgjdcbdo-1,megakaryocyte.,nondisease,Femur,nondisease,Mouse,Xenium,"[Image Pair 7]: This single cell is a non-cancerous megakaryocyte from mouse femur, identified by its large size, polyploid nucleus, and abundant granular cytoplasm. Megakaryocytes are responsible for the production of platelets, vital for blood clotting and maintaining hemostasis."
jgkhhlhp-1,erythrocyte.,nondisease,Femur,nondisease,Mouse,Xenium,"[Image Pair 8]: This single cell is a non-cancerous erythrocyte from mouse femur, recognized by its small, round, anuclear, and biconcave disc morphology. Erythrocytes' unique shape maximizes surface area for efficient gas exchange and oxygen transport throughout the body."
jgkkmmgm-1,neutrophil.,nondisease,Femur,nondisease,Mouse,Xenium,"[Image Pair 9]: This single cell is a non-cancerous neutrophil from mouse femur, showing a multi-lobed nucleus and granular cytoplasm. Neutrophils are frontline immune cells, swiftly responding to infection by phagocytosing bacteria and releasing antimicrobial factors."
jglbkaml-1,megakaryocyte.,nondisease,Femur,nondisease,Mouse,Xenium,"[Image Pair 10]: This single cell is a non-cancerous megakaryocyte from mouse femur, displaying very large size with a multilobed, polyploid nucleus and extensive cytoplasm. Megakaryocytes function to generate platelets, which are essential for blood clot formation and vascular repair."
jglimonh-1,fibroblast.,nondisease,Femur,nondisease,Mouse,Xenium,"[Image Pair 1]: This single cell is a non-cancerous fibroblast from the mouse femur, imaged using Xenium spatial transcriptomics. Fibroblasts exhibit a spindle-shaped morphology with elongated cytoplasm and an oval, centrally positioned nucleus. They are relatively large compared to hematopoietic cells, and their primary function is the synthesis and maintenance of the extracellular matrix, supporting tissue structure and repair."
jglngbma-1,"CD8-positive, alpha-beta thymocyte.",nondisease,Femur,nondisease,Mouse,Xenium,"[Image Pair 2]: This cell is a non-cancerous CD8-positive, alpha-beta thymocyte from the mouse femur, visualized using Xenium technology. Thymocytes are small, round cells with a high nuclear-to-cytoplasmic ratio and dense basophilic nuclei. As immature T lymphocytes, they play a central role in immune development, eventually maturing to mediate cytotoxic responses against infected or abnormal cells."
jgmnakbi-1,neutrophil.,nondisease,Femur,nondisease,Mouse,Xenium,"[Image Pair 3]: This cell is a non-cancerous neutrophil from the mouse femur, imaged by Xenium spatial transcriptomics. Neutrophils are characterized by their multilobed nucleus and granular cytoplasm, though single-cell views may show only part of the nucleus. These medium-sized cells are frontline immune responders, specializing in rapid phagocytosis and destruction of pathogens at sites of infection."
jgnbcpkm-1,monocyte.,nondisease,Femur,nondisease,Mouse,Xenium,"[Image Pair 4]: This cell is a non-cancerous monocyte from the mouse femur, visualized using Xenium spatial transcriptomics. Monocytes are large, oval-to-kidney-shaped cells with abundant pale cytoplasm and a folded or indented nucleus. They serve as circulating precursors to macrophages and dendritic cells, contributing to immune surveillance and phagocytic clearance of debris and pathogens."
jgnfdmae-1,neutrophil.,nondisease,Femur,nondisease,Mouse,Xenium,"[Image Pair 5]: This cell is a non-cancerous neutrophil from the mouse femur, obtained using Xenium spatial transcriptomics. Neutrophils typically display a segmented, multilobed nucleus and finely granular cytoplasm, serving as fast-acting phagocytes vital for early response to infections and inflammation."
jgphamag-1,monocyte.,nondisease,Femur,nondisease,Mouse,Xenium,"[Image Pair 6]: This cell is a non-cancerous monocyte from the mouse femur, identified using Xenium spatial transcriptomics. Monocytes are large cells with abundant pale cytoplasm and a distinct oval or bean-shaped nucleus. They are crucial for differentiating into tissue macrophages and dendritic cells involved in innate immune defense and tissue remodeling."
jgphccgn-1,monocyte.,nondisease,Femur,nondisease,Mouse,Xenium,"[Image Pair 7]: This cell is a non-cancerous monocyte from the mouse femur, imaged using Xenium spatial transcriptomics. Monocytes feature a spacious, lightly stained cytoplasm and a characteristic indented or kidney-shaped nucleus, acting as key precursors for macrophages and dendritic cells involved in immune surveillance and response."
jgpiloli-1,macrophage.,nondisease,Femur,nondisease,Mouse,Xenium,"[Image Pair 8]: This cell is a non-cancerous macrophage from the mouse femur, visualized with Xenium technology. Macrophages are large, irregularly shaped cells with abundant cytoplasm, often containing phagocytosed material, and an eccentrically placed nucleus. They are essential for engulfing pathogens, debris, and orchestrating tissue immune responses and repair."
jhacofam-1,megakaryocyte.,nondisease,Femur,nondisease,Mouse,Xenium,"[Image Pair 9]: This cell is a non-cancerous megakaryocyte from the mouse femur, imaged using Xenium spatial transcriptomics. Megakaryocytes are exceptionally large, with abundant granular cytoplasm and a multilobulated or polyploid nucleus, responsible for producing platelets critical for hemostasis and vascular integrity."
jhcflpbe-1,erythrocyte.,nondisease,Femur,nondisease,Mouse,Xenium,"[Image Pair 10]: This cell is a non-cancerous erythrocyte from the mouse femur, visualized via Xenium spatial transcriptomics. Erythrocytes are small, anucleate, biconcave discs, efficiently packed with hemoglobin, and specialized for oxygen transport throughout the circulatory system."
jhchnogn-1,endothelial cell of lymphatic vessel.,nondisease,Femur,nondisease,Mouse,Xenium,"[Image Pair 1]: This single, non-cancerous lymphatic endothelial cell from mouse femur appears elongated and spindle-shaped, with a thin, flattened morphology adapted for lining lymphatic vessels. Its streamlined structure facilitates efficient fluid transport and barrier integrity, maintaining tissue homeostasis. Xenium spatial transcriptomics reveals its spatial context within non-cancerous femoral tissue."
jhejpllj-1,macrophage.,nondisease,Femur,nondisease,Mouse,Xenium,"[Image Pair 2]: This non-cancerous macrophage from the mouse femur is a medium-sized, round to irregularly shaped cell with an eccentrically placed nucleus and abundant, granular cytoplasm. Its morphology supports its essential roles in phagocytosis and immune surveillance within the healthy bone marrow microenvironment revealed by Xenium spatial transcriptomics."
jhepngng-1,macrophage.,nondisease,Femur,nondisease,Mouse,Xenium,"[Image Pair 3]: This non-cancerous macrophage from mouse femur exhibits a round-to-ovoid shape with a moderate size, displaying a prominent nucleus and granular cytoplasm. Its structure facilitates phagocytosis and immune regulation, vital for clearing debris and maintaining tissue integrity in healthy bone marrow."
jhhficog-1,macrophage.,nondisease,Femur,nondisease,Mouse,Xenium,"[Image Pair 4]: This non-cancerous macrophage in mouse femur is characterized by a rounded, sometimes lobulated shape with occasional nuclear segmentation. The granular cytoplasm and relatively large size reflect its phagocytic role and contribution to bone marrow immune defense and debris clearance."
